id,link,title,content_list
0,https://www.segabg.com/category-cars/mercedes-benz-predstavi-nay-luksozniya-si-maybach, Mercedes-Benz представи най-луксозния си Maybach ,"['Една от най-очакваните автомобилни премиери\xa0за 2020 г.\xa0беше на новото поколение на Mercedes-Benz S-Class. Тя се състоя в началото на есента, а сега дойде време германският производител да покаже и най-луксозния вариант на модела. Традиционно лимузината ще предлага под марката Maybach, съобщава Automedia.bg.', 'В сравнение с удължения вариант на седана S-Class\xa0новият\xa0Maybach е по-дълъг\xa0с 1800 мм и достига 5469 мм. Така се добавя и разстояние между двете оси на луксозния автомобил и то вече е 3396 мм. Това е с 69 мм по-малко от Rolls-Royce Ghost Extended, но и с 202 мм повече от основния съперник на модела - Bentley Flying Spur.', 'На външен вид новият Mercedes-Maybach S-Class се отличава по оригиналната решетка на радиатора и бронята, удължените задни врати, ексклузивните джанти с размер от 19 до 21 цола, светещата емблема на задната стойка...\xa0Като опция се предлага комбинация от два цвята на каросерията с разделителна линия, като клиентът може да избира между 10 варианта.', 'Всички помощни функции за\xa0водача са достъпни още в базовото оборудване, като сред тях са шаси със завиваща задна ос на 10 градуса, 5 екрана в салона, система за допълнена реалност и други технологии, които дебютираха при флагмана на Mercedes тази есен. Задните седалки са разделени на две кресла, като това прави салона още по-просторен и по-луксозен.', 'Освен традиционното подгряване на седалки, поставка за краката с функция за масаж, има и подвижни масички, хладилник и комплект за шампанско, както и детайли от скъпо дърво. Задните врати се отварят с електронна команда от мястото на шофьора.', 'Вече е известно, че версията Mercedes-Maybach ще бъде единствената, за която ще се предлага 6,0-литров V12 двигател, но засега от компанията анонсират само умерено-хибридната модификация за пазара в САЩ. Тя е позната от стандартната S-Class, като получава 4,0-литров V8 с 503 к.с.\xa0и максимален въртящ момент от 700 Nm, комбиниран със стартер-генератор EQ Boost, който за кратък период добавя още 22 к.с.\xa0и 25 Nm.', 'Скоростната кутия е 9-степенна автоматична, като работи със система за задвижване на четирите колела. Времето за ускорение от 0 до 100 км/ч не се съобщава, но е известно, че максималната скорост е ограничена по електронен път на 210 км/ч.', 'Компанията пуска и кросоувър за пестене на данъци', 'Малко след премиерата на ултралуксозната S-Class, германският премиум бранд Maybach представи нова версия на кросоувъра GLS, която е по-евтина от стандартния автомобил. Към момента SUV моделът се предлага единствено в изпълнение GLS 600 с 4,0-литров битурбо V8 двигател, който развива мощност 558 к.с.\xa0Този вариант струва 172 000 евро ($204 000).', 'На пазара в Китай вече е достъпна и версията Mercedes-Maybach GLS 480, под чийто капак е разположен 3,0-литров турбомотор с 6 цилиндъра, който развива максимална мощност от 367 к.с. и въртящ момент 500 Nm. Системата EQ Boost осигурява допълнителни 22 к.с. за кратък период от време.', 'Ускорението от 0 до 100 км/ч отнема 6,6 сек., което е с 1,7 сек. по-бавно от топ варианта. Всичко останало, включително екстериорът, салонът и предлаганите опции, са напълно идентични при двата модела. Но пък цената на по-слабия всъдеход е 161 000 евро ($191 060).', 'Разликата може да не изглежда толкова сериозна, но в Китай автомобилите, струващи под $200 000, се облагат с по-нисък данък. А така\xa0собственикът на този Mercedes-Maybach GLS ще загуби откъм конски сили, но ще спести много повече пари.', '20.11.2020', '16.11.2020', '13.11.2020', 'Както се казва, като дойдеш с Майбах, може и по тениска.']"
1,https://www.segabg.com/category-observer/i-nezhna-plocha-se-vurti-vurhu-zhelezni-gramofoni,"  „И нежна плоча се върти
върху железни грамофони...” ","['Бях ви обещал този петък да разкажа за един страхотен български поет от ХХ век. „Той още е между нас, писах тогава, дишаме един и същи въздух, страниците му още не са пожълтели, но ние сме разсеяни за хубавите стихотворения и за техните автори, без да съзнаваме, че в поезията всичко е различно: ние си мислим, че и хубавата поезия отминава, а всъщност отминаваме ние.”\xa0Твърде преждевременно се оказа това обещание, живият поет се оттегли във вечността, където са неговите велики предходници, а вероятно и самите божества на поезията. Петър Караангов ни напусна, ако може това да се каже за един лирик, който ни оставя своето неподражаемо творчество. Стиховете на такива поети остават тук и, може би и вие сте забелязали, много скоро след смъртта им добиват своя истински, окончателен звук. Онзи звук, който е предназначен за поколенията...', 'Винаги съм казвал, че истинският поет не се стреми да е пръв – на него му е достатъчно да бъде единствен. За Петър Караангов това бе особено валидно. Дарбата му го бе направила единствен още от първите му книги и никой от десетките охотници да се приобщят към чуждия успех не се опита да наподобява неговия слог, нито неговия изпитателен и ласкав поглед към битието. \xa0Край неговите дюли и минзухари, златни ябълки и южни звезди, боботят метални валяци и камиони с тежки ремаркета, излитат и кацат алуминиеви самолети – „скакалци праисторически”. Той ги приобщава, съчетава, слага ги под сърцето си. ', 'Във всяка висока поезия има нещо невъзможно, непостижимо – освен за едного. Така и Караангов си играе с невъзможното, постижимо само за него. Прозаично и дори противопоказно слово („каси с карамели”, „бурета със бира”) в неговия стих запява, изгражда тържествената мелодика на живота. Изглежда това е неговото кредо за поезията: да стопли, да озвучи суровата му тъкан, да добави очарование на действителността, да я очовечи, да я освети. Най-хубавата метафора за поезията през нашия век съм намерил в стихотворението му „Минава лятото”:', '\xa0\xa0\xa0\xa0 И нежна плоча се върти', '\xa0\xa0\xa0\xa0 върху железни грамофони. ', 'Това, мисля, изказва цялото й предназначение: да изтръгва нежна, човешка музика под безмилостната игла на времето. ', 'Поетът владее необяснимия дар да превръща думите в други думи, същите по състав, но с различно, еднократно,възможно само за него значение. Различно, защото, поставени в стиха му, те са другояче озарени и другояче почувствани. И еднократно, защото никога повече не могат да бъдат използвани\xa0 в този смисъл и с тая красота, както от него. Той може да гребне шепа най-банални рими, от които дори графоманите се пазят, и да извае куплети като украшение на поетическото тайнство.', 'Аз вземам мокра тъмна глина', 'и слагам светлинка във нея...', 'Така през мрака на годините', 'със този жест ще оцелея.', '\xa0\xa0\xa0\xa0\xa0\xa0\xa0\xa0\xa0 \xa0\xa0\xa0\xa0\xa0\xa0\xa0\xa0\xa0 („Жест”)', 'И това може да бъде като образ на поезията. Но той го опровергаваше: и всеки друг меси своята глина, казваше, и напразен е трудът му, ако не успее да вложи светлинката в нея. Едновременно разкрепостен и класичен, и в свободния стих съчетаваше думите като магьосник. Веднъж му подметнах, че, роден в Свети врач, бездруго е наследил нещо от маговете край горещите извори. Каза, че тази версия е удобна за неговите критици: по-лесно е да го минеш – него, Караангов – като природно явление, отколкото като явление в поезията. Но това беше вече по-късно...', 'Запознахме се в редакцията на сп. „Пламък”. Минавах през София като войник и се отбих в редакцията да питам за съдбата на стихове, които бях изпратил. Притеснен, разбира се, шинелът ми висеше, кабарите на подметките ми драскаха паркета. Още не бях прочел „Жив съм” от Веселин Ханчев, от Караангов – само „Сезоните и нашата улица”. И не схващах добре какви вълшебници на поезията ми стискат ръката, четат един след друг стиховете ми и обсъждат в коя книжка на списанието да ги отпечатат. На сбогуване Ханчев кой знае защо ми каза: „Пази се!”. После стиховете ми наистина излязоха. Но трябваше да мине време, за да прочета още и да осъзная какви велики майстори са били тези мъже от първото ми литературно запознанство в София.', 'Общувахме през годините, имали сме шанса и да се наприказваме, но говорехме – той говореше – главно за неговия роден Сандански: разказваше ми за\xa0 градчето, за хората му, за неповторими\xa0 екземпляри и характери, които той изрязваше на фона на тогавашния живот. Така ги предаваше, не, изиграваше, че когато за първи път се\xa0 озовах там, все чаках да ги видя. Но тези очарователни разкази никога не изместиха стиховете, които се запечатваха в душата и я вълнуваха с това, че остават неразгадаеми дори за един нелош познавач на поетическото майсторство, в какъвто с годините се превръщах. Петър Караангов остана единствения поет, комуто съм завиждал – за тайните, които в неговите стихове минават отвъд думите. Зад обикновената, понякога нарочно укротена реч, той казва още нещо, което не си способен нито да изразиш, нито да преведеш – а тъкмо то те завладява, прави те безсънен. ', 'Пак вятър във пейзажа.', '\xa0\xa0\xa0\xa0\xa0\xa0\xa0\xa0\xa0\xa0\xa0\xa0\xa0\xa0\xa0\xa0\xa0\xa0\xa0\xa0 Вятър!', 'Съдът от вятър се люлее.', 'Ах, този странен съд – земята,', 'във който хората живеят!', '\xa0\xa0\xa0\xa0\xa0\xa0\xa0\xa0\xa0 \xa0\xa0\xa0\xa0\xa0\xa0\xa0\xa0\xa0 („Вятър в пейзажа”)', 'На силен камък нежен лишей свети.', 'Гнездо живей над стряхата от кал.', '\xa0\xa0\xa0\xa0\xa0\xa0\xa0\xa0\xa0\xa0\xa0\xa0\xa0\xa0\xa0\xa0\xa0\xa0\xa0\xa0 („Зелена светлина”)', 'Калейдоскопично подредени образи, понякога разточителни, друг път бегли, маркирани – мерките му за поетическо изкуство остават неразгадаеми, те не могат да бъдат наподобени, а според мен не могат да бъдат и изучавани. При него дори простотата е непостижима, караанговска. Да не говорим за майсторството му да словосъчетава!', 'Преди пет десетилетия, в една от най-нежните му книги, „Внезапно лято”, е отпечатано стихотворението „Кръвта остава” – между най-хубавите български стихотворения на ХХ век. То е песен за болката на разсечения на две народ, за неговата горест и неправда – Македония. Тук висотата на поетическата форма е неподражаема, модерното и стариннопесенното са сплавени до блясък. Никой не е написал\xa0 след него така дълбоко и красиво за тази драма. (Цялото стихотворение вж. в „Сега” от 9 август 2019 г.)', 'По някакво жестоко, многозначително съвпадение събитията в дните на неговото заминаване от нашия свят разбуждат това стихотворение и тихият караанговски шепот\xa0 от финала му гърми като заклинание, но и като въпрос:', 'Когато и нас ни няма вече,', 'кръвта остава!', 'Колкото до мене, аз вярвам, че в голямата поезия неизбежно се съдържа пророчество. ', 'Тези редове не бяха, за да ви убеждавам във величието на приятеля Петър Караангов. Проверете думите ми в неговите книги. Те, книгите, \xa0още дълго ще бъдат тук. Ще бъдат тук даже и след нас. В едно от късните си стихотворения, той предсказа финала на своя живот: „като забравена ябълка във декемврийско дърво”.\xa0 Може би това беше, за да свикваме без него, та да приемем по-лесно отлитането му от нас. Но не й се получи на съдбата, продължаваме да го виждаме тук – такъв, какъвто сам се е запечатил в незабравимото стихотворение „Вечерен праг”:', 'Стоя пред своя дом сега... Замислен!', 'Над спомена наведен. Над нещата!', 'Над масата. Над прага. Над реката,', 'която носи пожълтели листи.', 'Над есенния дълъг дъжд, над влака,', 'над пътя, отпечатал мойта стъпка,', 'над розата, над късната й пъпка,', 'която като свещ просветва в мрака.', '19.11.2020', ' КАЛИН ДОНКОВ ', '17.11.2020', '12.11.2020', ' КАЛИН ДОНКОВ ']"
